Interviewer,Interviewee,Participant ID
"Got it. Going forward, when you think about now you know all of these different applications of ultrasound and all the different subspecialties involved, and the fact that most specialties really don't—they're not coming out of their training with these skills, right. A lotta folks are either picking them up as faculty because it's just the technology's so new. What do you think this is gonna look like going forward? You've given a ton of work to it, but what do you think is really needed to ensure sort of the quality that we're striving for as an institution?","That's a good question. In an ideal world, frankly, what I see is someone comes into the role of really the POCUS champion or the POCUS chair who sorta has some level of governance over that quality committee and helps understand sort of proctorship abilities, understands electronic medical records, understands archival storage of images, understands how to set up quality review processes for ultrasound utilization, and then even more importantly is involved in some of the decision-making for really supply chain because, as you are very aware, these machines can be as much as a transducer hooked up to a cell phone.",G7
"I wanna be respectful of your time, but just a couple of additional sort of more pointed questions. Do you think, from the system perspective, that the—and who asked you to chair this committee? Was it one of the C-suite? Who had charged you with this?","… knowledge of the prior road of POCUS and knew that it had never quite passed the finish line. They also knew that I was from the Department of OB-GYN, using POCUS on a very frequent basis, so they thought perhaps having somebody who had sorta used the tool intimately may have a better opportunity of gathering consensus, is my feeling.",G7
"Got it. They saw this need and they thought you were the appropriate person given, obviously, how important this is to OB. That totally makes sense. I guess, do you think that they were worried about malpractice? Do you think that's one of the reasons that they've really tried to kinda focus on this?","No, I don't. I think it was more to drive just some very basic organizational kind of things. If you provide imaging, you provide a report and an image. I think they wanted to make sure that ultrasound wasn't being used haphazardly for clinical diagnostic purposes, and that we as a community of faculty had the highest level of quality. I don't think malpractice was ever—those words never came up in any of the conversations I had. It was more what drives quality. How do we assure that people are utilizing the tool correctly and not tinkering with a diagnostic procedural skill without clear understanding? I think there are many steps that are ongoing because what we've done is we've done something on a faculty side, but this has to cross and meet the hospital side as well, so there has to be some collaboration and communication with our nursing resources as well because this comes down to the very basic things that we do.",G7
Is the hospital sort of perspective like that's wonderful to hear that it's really driven by just the desire for high-quality care and making sure this tool is being used optimally within the health system because I'm sure they have other priorities and they could kind of not necessarily put attention to this. Do you think that they want to move toward investing in infrastructure and training in order to—and quality assurance and so forth? What do they want to invest in order to help ensure quality? 'Cause it seems like they have been investing.,"I don't have an assessment of that. Everybody wants something to be done, but they also want it to be done inexpensively and to save resources, but time is a resource. To me, you put somebody who has the knowledge and the skill set, time has to be dedicated toward that, and time costs. I can't answer those questions, honestly. I've not been involved in those higher-level discussions. To me, I feel like we have to get the basic components down, and then the chair of that POCUS group can really move those processes forward and state this is what we need, this is how much time it's gonna take, this is the potential cost to underwrite this type of a quality measure. Those are skills that are beyond my skill set, frankly.",G7
"Any other thoughts about—how long is this gonna evolve, do you think?","To get the one document. I was like this is pretty much written already, but clearly I was wrong on that. I think you have to identify a chair of this POCUS committee who can work on some of those quality processes, work in supply chain with our nursing leadership, work with radiology. We have great resources in radiology who have been involved in the archival storage system with electronic medical records because those are the tools that we utilize every day, and why are we making it so hard for providers to use these resources? Somebody who has really a passion to drive those things forward, even just small wins should be looked at as great things. Even if the pie in the sky isn't reached in the first couple of years, it's working and achieving those structures to me is valuable.",G7
"Yeah. I wanna be respectful of your time, so I'm gonna go ahead and stop recording.",[No Reply],G7
"Navigate. Okay. Find the right interview guide. All right. We are interviewing stakeholders to understand the determinants of implementation of lung ultrasound. You've been asked to be interviewed because you may be affected by POCUS implementation. Interviews will be de-identified, recorded, and transcribed. Do you consent to being interviewed? Deb?",My zoom took a [laughter 00:37].,G2
It's all right.,"- I had to sign in and sign back out, so—",G2
"Oh, okay. Do you want me to start over?",Are you sharing something now?,G2
"No, I had just done a little, a verbal consent. I'll start over. We are interviewing stakeholders to understand the determinants of implementation of lung ultrasound. You have been asked to be interviewed because you may be affected by lung ultrasound implementation. Interviews will be de-identified, recorded, and transcribed. Do you consent to being interviewed?",Sure.,G2
"Okay. Please keep in mind that there are no right or wrong answers to any of the questions I ask you today. If a question is unclear, please just ask me to clarify. What is your professional title and job description?",I guess you want my admin one.,G2
Yeah.,"I'm a senior medical director for UC health, for clinical documentation integrity.",G2
Okay. Great. Are you just here at [unintelligible 01:44] or what hospitals do you oversee in regard to that?,"Well, I directly work with on a frontline level with the Denver Metro hospitals, but I'm the senior medical director for the system.",G2
"Okay. Can you describe what those responsibilities entail before COVID and maybe after COVID too, just briefly?","Yeah. When I first started doing all this, I was doing utilization management care management and CDI, and of recent in the last few years, I've whittled down to specialize in the CDI piece. I work as basically a liaison between the CDI nurses, coding and clinicians, and provide education, not just on day-to-day specificity of documentation, but also, on how to frame things in such a way that quality metrics are attributed appropriately to our hospital and our clinicians and the service lines. Then I also I work very closely with quality on various initiatives that involve not only documentation, but spill over into the clinical.",G2
"Okay. Oh, I'm talking to the perfect person. That's great. Then with COVID have any of those responsibilities changed? I'm assuming there are a lot of issues around CDI and all that stuff with COVID, but—","Yeah. As you can imagine, the CDI nurses have been pulled every which way that loose, they actually we're doing the CCIs, they were the ones filling out the CCIs. A lot of them got pulled for that as well as for clinical. We've had to step up as the physician advisors and medical directors of CDI and come to escalating things to physicians who are more than direct contact than it had been before.",G2
"Got it. Okay. If that's the case then my next question is, I told you a little bit about lung ultrasound and I'm wondering, how do you make—how do you discuss an intervention like this where you feel like there's gonna be a clinical benefit? How do you make it something that the administrators will invest in and come on board with?","Well, obviously there's a cost savings, that's important, but also before we did this interview, I thought we were talking about just specifically POCUS and specific things with the lungs that we were already doing. The reason that, that was important too, was, is one of the patient's safety indicators through DHHS is Iatrogenic pneumothorax. You can imagine there, well, where in the setting of pneumothorax, the data could be much improved. I would presume from doing direct visualization, thorax and teases, as opposed to doing those blindly. Anything that can show value to patients and improve outcomes obviously is important.",G2
"Oh, great. We know that's all well-documented the literature that patients love POCUS and so it's actually not even something I am collecting data on because it's so well known. How are those metrics acquired and talked about in our hospital in terms of the patient experience?","Yeah. The patient experience specifically part that's under not my umbrella it's really under Patrick's and now it spread out in a different way, but I think before it related a lot to surveys, the data that came back through CMS data, the specific questions that were asked of the patients that sort of thing. Then we would actually—we would compare how we were doing and with patient experience against best in class I'll call, and as well as along in our system a competition across our system to be the best there too, as far as UCH.",G2
Do you feel like that—is that another big driver of  what's invested in?,"Oh, yeah, I think so. I'm jumping ahead, but certainly if that data is already there and clear, that certainly would be in a courtroom to include in a case for this.",G2
Got it. Okay. What else?,"'Cause if you think about it, that's big driver, not only in reputation, but also on value-based purchasing and other things, so—",G2
"Right. I'll just tell you a little bit about the billing data that we've collected. Basically, we're collecting $23 per lung ultrasound and in terms indications for lung ultrasound. It's basically again, there are centers that are using it as for—and the data supports using it as first-line for anyone who is dismic 09:08 or anyone who has any changed decompensation in their respiratory status, and also actually in the emergency room. I'm actually working with the ED to implement among their providers as well. The other piece of it actually, is that this is not unique to hospital medicine. I think we're one of the people that are really pushing for it nationally, but it's also actually in other subspecialties.","Well, I think anything that is far reaching, whether it's far reaching across the hospital or especially if it's something that's far reaching across the system is always an advantage.",G2
What role do you think guidelines and studies play in adoption by administrators in supporting the infrastructure for something like this.,"I think that that doesn't hurt and when you present to whatever group you're gonna present to obviously not going into a huge level of detail, 'cause there will be people probably that aren't necessarily clinical, but getting the salient points across and obviously the broader the audience of the studies the better.",G2
"Based on what I've told you so far, what pitfalls do you potentially see in implementation or from the perspective of your perspective in terms of what you do or some of the other stakeholders that I basically talk to clinicians, I don't really talk to any other administrators. Anything else that you think is a potential pitfall or a facilitator that I should talk about?","Sure. I think the two things that come to mind and I'm not sure exactly where these would fall into those categories, but just things that come to mind is as if we're going to be doing more ultrasounds than study and radiology, radiology is certainly a stakeholder in that. I think we've already gotten a good relationship with, as you mentioned the ICU folks, so that probably is not an issue. They're probably be thankful that those are being done out on the floor as well. Again, the role or lack of role of need for radiology techs to come and help what impact that is. Is that gonna be less work because they're not having to come and do films as much as there's gonna be more work for some reason? What that impact is gonna be? Would be a couple of things I can think of offhand.",G2
"Actually, they're very much on board, which is really interesting. It was actually the—actually one of my radiology—I was thinking about it in heart failure and then it was actually one of my radiology colleagues who we're in the same research training group. He was like, ""Can you please get people to stop ordering chest x-rays with your lung ultrasound?"" That's how that conversation got started in terms of the de-implementation or replacement of chest x-ray with lung ultrasound in terms of my own work.",Are you looking now mostly at UCH?,G2
"Right now, we're looking at UCH, but I think that this is probably the same. Right now, I'm focused on UCH because this is where our pilot study is gonna be going forward, but I think that these principles hold nationally with the exception of maybe the VA.","I just don’t know if [crosstalk 14:26] financial impact that's a little bit different in the private hospitals than might be at the university. If you're thinking of expanding it outside of academia, I would certainly re-engage any of those local folks as well.",G2
"That's a good point. Yeah, and in particularly if they're not doing the really fancy tertiary care center tests, right? Like chest x-rays, maybe something because—","I don't know what that impact would be financially on other or other on radiology, but it would be good to know whether you started doing that or are implementing things I would think.",G2
"Yeah, that's a great point. Yeah. Right now, we're just really looking at academic centers. I think the VA is the other place where no one really cares too much about, tuff too much because of their billing set up, but yeah. I think that those are all my big picture questions. Actually, what can you think of another initiative that, or other things that have been taken up by the system successfully, and then some that have, have not and talk about sort of the differences between those so I can learn from successful examples?","Yeah. Gosh. I'm trying to think, because in CDI the focus has been a little bit narrower as far as 'cause a lot of this stuff is more utilization management. You think about maybe analogies would be what of the super expensive, maybe not covered chemos and other high-cost drugs are accepted those kinds of things. I think in that setting, if people say I want a drug because I want a drug that's not very effective, [laughter] but if they can show the data on it to make P&T committee and all the ones involved be supportive.",G2
"Got it. As much as you— Oh, go ahead.","Also, in thinking about the respiratory viral panels and the flu tests and GI and PCRs and when to test for C. Diff and use the toxins or not. All those things apply as well. Its really data driven.",G2
"Then who hears these arguments? How does that work? You have some clinician with an idea, they're getting their arguments and ducks in a row. Then how does it work up the chain to the person who's gonna make the decision?","That's a good question. 'Cause there's been in the last few months, a lot of a fair amount of re-organization of committees, like trying to make sure that they make sense that there's a good reporting structure that there aren't excessive duplicative committees and things like that. I'm thinking to start with the players that historically have been looking at these things are our COO.",G2
That'd be great.,- offline and try to help figure it out that what would be the most effective way to go with it.,G2
"Okay. Thanks. Then, so it sounds like it's basically cost of it, evidence of efficacy and patient experience. Those are the big drivers?","Yes. Of course, if they can do anything to automatic quality metrics, like I said, in the setting of if you wanted to do ultrasound, which you're already doing to do a thoracentesis and it can decrease the number of deems that we get from CNS for having, Iatrogenic pneumathorax, figuring that, that's a benefit.",G2
"Yeah, definitely. Okay. The procedural piece. Where are the quality metrics? Is there a list of those?",I was gonna show you this. I was actually gonna collect some data for you for what turned out to be the wrong thing.,G2
"Oh, you're so sweet.",Where did I have this? I'm trying to find a slide for you that I can share here in just a second.,G2
"Yeah. I know that the Medicare, like the CMS, they publish every year, new reimbursement guidelines. Is that right?","There's a bunch of different things. At CMS there's the hospital readmission reduction program [crosstalk 21:00] there's purchasing program. There's the hospital acquired conditions reduction program. For the hospital acquired condition reduction program within that post-op these patient's safety and or caters lie of which one is the Iatrogenic pneumothorax, and essentially, all of these programs have their own financial effect, but for that one in specific, like if we're in the bottom, I have to look at my slide, but if we're in the bottom core tile of hospitals in regard to having too many of these patient safety indicators, then our entire Medicare reimbursements are decreased by 1 percent, which doesn't sound like a lot if you think about how much Medicare there is out there that's a lot. Then you start adding on other things. There are also value-based purchasing agreements with various payers from time to time.",G2
It's complex.,What's that?,G2
It sounds very complex.,"It is very complex. I can explain this all day, if you wanted to go to —I think I have a link to the HRQ site and it basically goes through the various patient safety indicators involved with that. Also, I'm just blabbering right now a lot of stuff, but one of the programs in hospital readmission is heart failure readmissions. If we're more competent as to whether or not something is heart failure, we code that correctly, then obviously that can make a difference as opposed to calling something heart failure that's not heart failure.",G2
"Oh, yeah. Yeah. I was thinking about just the","Or at even the worse calling it heart failure and it actually wasn't heart failure. Then they come back in because for heart failure, the readmissions are all costs. If I'm admitted with heart failure and then in a week, I get hit by a truck and come in with a femur fracture that counted as a readmission. You wanna make sure that index admission is coded appropriately.",G2
Is it the quality officer for the hospital that is responsible for keeping tabs on all of these different metrics and troubleshooting where there's a problem?,"Yeah. We work on that actually very closely together. I actually do all the reviews for Denver Metro when there's a potential patient safety indicator, and I'm the second level review. The first level review is one of the CDI nurses and they look and see if there are any exclusion.",G2
Okay. That is so complicated. Then my understanding is that we've always done very well with heart failure. In terms of readmission and that was never something that they were focused on in our particular hospital.,"Again, it depends on what data that you're looking at too, because again, this is way in the leads, but for example, Visiant has various service lines within Visiant and there's the cardiology service line. Then their metrics are based on DRGs that we may be taking care of the patient for.",G2
"Yeah. Yeah. There's actually randomized control trial demonstrating lung ultrasound guided diuresis, can reduce length of stay. Then you can definitely expedite diagnosis, right? If you know on day one, this is heart failure and not COPD like then you don't have to—","[Crosstalk 27:17] something waiting give him the echo the next day, waiting [unintelligible 27:22].",G2
Right. Like he's not responding to the NABS. Let's just give him [unintelligible 27:25] and see if it helps.,"Yeah, and see what happens, exactly. That empiric stuff and not knowing what we're really doing is part of the problem with the metrics. We don't get those diagnoses right. That actually comes to another point too, is there's length of stay data out there that we want those metrics to be where they should be, if anybody knows",G2
"Right. It sounds like in POCUS and lung and these other—for instance, like getting the paracentesis done in the ED, as opposed to having them be admitted and then—","Oh, my God."" I hate it when they take off two CCs and they come up with a belly full of varieties.",G2
"Right. Like POCUS has the—in our hands when we're the providers, I think has all sorts of ways to expedite care, which is better for the patient and everybody. One other thing one of the concerns I've experienced with clinicians around POCUS, is that they're concerned that the POCUS is gonna add to the bill for the patient. As you know, I'm not the best hospitals with regard to understanding billing. It sounds, as you can tell me, you can educate me on this. It's a DR—go ahead.","Yeah. Here's the deal. When a patient is hospitalized, we have some contracts that are like percent of charges and that stuff, but then that's majority of those are based on observation reimbursement or inpatient reimbursements. We get paid by a certain DRG, and substantially when, as far as from the hospital standpoint if we do—if we have an OBS patient and we do an echo, an x-ray, and I dunno, I'm just making up exams and all that, we're actually losing money because it's pulling it from that DRG. From this patient standpoint, what they're paying for is part of the professional fee. They're gonna pay a professional fee, whether it is an x-ray or an ultrasound, or fill in the blank for the read on that. If you're substituting one thing for other studies, as opposed to adding studies, then I don't see how that creates an additional cost.",G2
Okay. The patients do get charged something for these diagnostic studies it's like a portion of the professional fee. Is that what you're saying?,"Right. If you take, just—you can't speak too much except for Medicare and maybe Medicaid because everything else is contractually based. That's why people are always using Medicare. It could vary from payer to payer, from hospital to hospital. I'm not privy to all of that, but for example, for Medicare, they would pay 20 percent. Actually, let me see facility diagnosis. Yeah. They would pay 20 percent of the CT interpretation, or the echo interpretation, or the EKG interpretation.",G2
"They're way more than those. Oh, so you're saying like one more test is not in terms of what they end up paying is not that. You're saying it's a small fraction?","Again, I'm looking at a very old slide. If you had an initial H& P that a nine, nine, two, two three, then that would be $204.22 of which they paid 20 percent, as opposed to a CT interpretation, which is $43.35 and 20 percent of that. If we want to do patients for favors, we would stop putting in profi fees for these patients that are sittin' there and we're not doing anything for 'em. That would be a bigger benefit than actually [laughter].",G2
"To be honest, it's very complex. I'm getting a little lost, but I'm just—",Let me see if I can show you—,G2
"No, it's okay. Well, I have one really basic question then we can—'cause I'm realizing I'm gonna definitely need you on my micro costing studies. [Laughter] I'll be bugging you about this.",You'll be what?,G2
"Well, I'm gonna be doing these micro costing studies which basically a way to determine the cost of an intervention where no—that's implemented in a system where no cost data really exists. If that makes sense. They call it micro costing because what something costs is very, to a certain incentive it's contextual. Right?",It's very contextual.,G2
It depends on how much the people involved. They're getting paid. That depends on location. You know what I mean? Like the same test—,"For example, these examples you're talking about, depending on what deductibles are and all that stuff, it would cost a patient way more to get a study as an outpatient than an inpatient.",G2
